Reading OpenROAD database at '/home/kien/openlane2/MARCO/decode_day/runs/RUN_2026-01-15_20-14-16/40-openroad-repairantennas/1-diodeinsertion/decode_day.odb'…
Reading library file at '/home/kien/.volare/volare/sky130/versions/0fe599b2afb6708d281543108caf8310912f54af/sky130A/libs.ref/sky130_fd_sc_hd/lib/sky130_fd_sc_hd__tt_025C_1v80.lib'…
Reading design constraints file at '/nix/store/4pyixb03xfwwy77zxxplrggxrmm9f57y-python3-3.11.9-env/lib/python3.11/site-packages/openlane/scripts/base.sdc'…
[WARNING STA-0366] port '__VIRTUAL_CLK__' not found.
[INFO] Using clock __VIRTUAL_CLK__…
[INFO] Setting output delay to: 2
[INFO] Setting input delay to: 2
[WARNING STA-0366] port '__VIRTUAL_CLK__' not found.
[INFO] Setting load to: 0.033442
[INFO] Setting clock uncertainty to: 0.25
[INFO] Setting clock transition to: 0.1499999999999999944488848768742172978818416595458984375
[WARNING STA-0419] transition time can not be specified for virtual clocks.
[INFO] Setting timing derate to: 5%
[WARNING STA-0450] virtual clock __VIRTUAL_CLK__ can not be propagated.
[INFO ORD-0030] Using 16 thread(s).
[INFO DRT-0149] Reading tech and libs.
[WARNING DRT-0349] LEF58_ENCLOSURE with no CUTCLASS is not supported. Skipping for layer mcon
[WARNING DRT-0349] LEF58_ENCLOSURE with no CUTCLASS is not supported. Skipping for layer mcon
[WARNING DRT-0349] LEF58_ENCLOSURE with no CUTCLASS is not supported. Skipping for layer via
[WARNING DRT-0349] LEF58_ENCLOSURE with no CUTCLASS is not supported. Skipping for layer via
[WARNING DRT-0349] LEF58_ENCLOSURE with no CUTCLASS is not supported. Skipping for layer via2
[WARNING DRT-0349] LEF58_ENCLOSURE with no CUTCLASS is not supported. Skipping for layer via2
[WARNING DRT-0349] LEF58_ENCLOSURE with no CUTCLASS is not supported. Skipping for layer via3
[WARNING DRT-0349] LEF58_ENCLOSURE with no CUTCLASS is not supported. Skipping for layer via3
[WARNING DRT-0349] LEF58_ENCLOSURE with no CUTCLASS is not supported. Skipping for layer via4
[WARNING DRT-0349] LEF58_ENCLOSURE with no CUTCLASS is not supported. Skipping for layer via4

Units:                1000
Number of layers:     13
Number of macros:     441
Number of vias:       28
Number of viarulegen: 25

[INFO DRT-0150] Reading design.

Design:                   decode_day
Die area:                 ( 0 0 ) ( 50000 50000 )
Number of track patterns: 12
Number of DEF vias:       0
Number of components:     57
Number of terminals:      24
Number of snets:          2
Number of nets:           37

[INFO DRT-0167] List of default vias:
  Layer via
    default via: M1M2_PR
  Layer via2
    default via: M2M3_PR
  Layer via3
    default via: M3M4_PR
  Layer via4
    default via: M4M5_PR
[INFO DRT-0162] Library cell analysis.
[INFO DRT-0163] Instance analysis.
[INFO DRT-0164] Number of unique instances = 23.
[INFO DRT-0168] Init region query.
[INFO DRT-0024]   Complete FR_MASTERSLICE.
[INFO DRT-0024]   Complete licon.
[INFO DRT-0024]   Complete li1.
[INFO DRT-0024]   Complete mcon.
[INFO DRT-0024]   Complete met1.
[INFO DRT-0024]   Complete via.
[INFO DRT-0024]   Complete met2.
[INFO DRT-0024]   Complete via2.
[INFO DRT-0024]   Complete met3.
[INFO DRT-0024]   Complete via3.
[INFO DRT-0024]   Complete met4.
[INFO DRT-0024]   Complete via4.
[INFO DRT-0024]   Complete met5.
[INFO DRT-0033] FR_MASTERSLICE shape region query size = 0.
[INFO DRT-0033] licon shape region query size = 0.
[INFO DRT-0033] li1 shape region query size = 514.
[INFO DRT-0033] mcon shape region query size = 0.
[INFO DRT-0033] met1 shape region query size = 136.
[INFO DRT-0033] via shape region query size = 55.
[INFO DRT-0033] met2 shape region query size = 55.
[INFO DRT-0033] via2 shape region query size = 44.
[INFO DRT-0033] met3 shape region query size = 33.
[INFO DRT-0033] via3 shape region query size = 44.
[INFO DRT-0033] met4 shape region query size = 15.
[INFO DRT-0033] via4 shape region query size = 0.
[INFO DRT-0033] met5 shape region query size = 0.
[INFO DRT-0165] Start pin access.
[INFO DRT-0078]   Complete 43 pins.
[INFO DRT-0081]   Complete 17 unique inst patterns.
[INFO DRT-0084]   Complete 21 groups.
#scanned instances     = 57
#unique  instances     = 23
#stdCellGenAp          = 309
#stdCellValidPlanarAp  = 0
#stdCellValidViaAp     = 242
#stdCellPinNoAp        = 0
#stdCellPinCnt         = 56
#instTermValidViaApCnt = 0
#macroGenAp            = 0
#macroValidPlanarAp    = 0
#macroValidViaAp       = 0
#macroNoAp             = 0
[INFO DRT-0166] Complete pin access.
[INFO DRT-0267] cpu time = 00:00:01, elapsed time = 00:00:00, memory = 135.69 (MB), peak = 135.69 (MB)

[INFO DRT-0157] Number of guides:     132

[INFO DRT-0169] Post process guides.
[INFO DRT-0176] GCELLGRID X 0 DO 7 STEP 6900 ;
[INFO DRT-0177] GCELLGRID Y 0 DO 7 STEP 6900 ;
[INFO DRT-0028]   Complete FR_MASTERSLICE.
[INFO DRT-0028]   Complete licon.
[INFO DRT-0028]   Complete li1.
[INFO DRT-0028]   Complete mcon.
[INFO DRT-0028]   Complete met1.
[INFO DRT-0028]   Complete via.
[INFO DRT-0028]   Complete met2.
[INFO DRT-0028]   Complete via2.
[INFO DRT-0028]   Complete met3.
[INFO DRT-0028]   Complete via3.
[INFO DRT-0028]   Complete met4.
[INFO DRT-0028]   Complete via4.
[INFO DRT-0028]   Complete met5.
[INFO DRT-0178] Init guide query.
[INFO DRT-0035]   Complete FR_MASTERSLICE (guide).
[INFO DRT-0035]   Complete licon (guide).
[INFO DRT-0035]   Complete li1 (guide).
[INFO DRT-0035]   Complete mcon (guide).
[INFO DRT-0035]   Complete met1 (guide).
[INFO DRT-0035]   Complete via (guide).
[INFO DRT-0035]   Complete met2 (guide).
[INFO DRT-0035]   Complete via2 (guide).
[INFO DRT-0035]   Complete met3 (guide).
[INFO DRT-0035]   Complete via3 (guide).
[INFO DRT-0035]   Complete met4 (guide).
[INFO DRT-0035]   Complete via4 (guide).
[INFO DRT-0035]   Complete met5 (guide).
[INFO DRT-0036] FR_MASTERSLICE guide region query size = 0.
[INFO DRT-0036] licon guide region query size = 0.
[INFO DRT-0036] li1 guide region query size = 48.
[INFO DRT-0036] mcon guide region query size = 0.
[INFO DRT-0036] met1 guide region query size = 38.
[INFO DRT-0036] via guide region query size = 0.
[INFO DRT-0036] met2 guide region query size = 26.
[INFO DRT-0036] via2 guide region query size = 0.
[INFO DRT-0036] met3 guide region query size = 0.
[INFO DRT-0036] via3 guide region query size = 0.
[INFO DRT-0036] met4 guide region query size = 0.
[INFO DRT-0036] via4 guide region query size = 0.
[INFO DRT-0036] met5 guide region query size = 0.
[INFO DRT-0179] Init gr pin query.
[INFO DRT-0245] skipped writing guide updates to database.
[INFO DRT-0185] Post process initialize RPin region query.
[INFO DRT-0181] Start track assignment.
[INFO DRT-0184] Done with 74 vertical wires in 1 frboxes and 38 horizontal wires in 1 frboxes.
[INFO DRT-0186] Done with 4 vertical wires in 1 frboxes and 11 horizontal wires in 1 frboxes.
[INFO DRT-0182] Complete track assignment.
[INFO DRT-0267] cpu time = 00:00:00, elapsed time = 00:00:00, memory = 136.31 (MB), peak = 136.31 (MB)
[INFO DRT-0187] Start routing data preparation.
[INFO DRT-0267] cpu time = 00:00:00, elapsed time = 00:00:00, memory = 136.44 (MB), peak = 136.44 (MB)
[INFO DRT-0194] Start detail routing.
[INFO DRT-0195] Start 0th optimization iteration.
    Completing 10% with 0 violations.
    elapsed time = 00:00:00, memory = 139.18 (MB).
[INFO DRT-0199]   Number of violations = 1.
Viol/Layer        met1
Short                1
[INFO DRT-0267] cpu time = 00:00:04, elapsed time = 00:00:00, memory = 489.53 (MB), peak = 501.30 (MB)
Total wire length = 410 um.
Total wire length on LAYER li1 = 0 um.
Total wire length on LAYER met1 = 169 um.
Total wire length on LAYER met2 = 240 um.
Total wire length on LAYER met3 = 0 um.
Total wire length on LAYER met4 = 0 um.
Total wire length on LAYER met5 = 0 um.
Total number of vias = 96.
Up-via summary (total 96):

---------------------
 FR_MASTERSLICE     0
            li1    56
           met1    40
           met2     0
           met3     0
           met4     0
---------------------
                   96


[INFO DRT-0195] Start 1st optimization iteration.
    Completing 10% with 1 violations.
    elapsed time = 00:00:00, memory = 491.53 (MB).
    Completing 20% with 1 violations.
    elapsed time = 00:00:00, memory = 493.78 (MB).
    Completing 30% with 0 violations.
    elapsed time = 00:00:00, memory = 495.53 (MB).
    Completing 40% with 0 violations.
    elapsed time = 00:00:00, memory = 496.53 (MB).
[INFO DRT-0199]   Number of violations = 0.
[INFO DRT-0267] cpu time = 00:00:03, elapsed time = 00:00:00, memory = 497.65 (MB), peak = 509.41 (MB)
Total wire length = 412 um.
Total wire length on LAYER li1 = 0 um.
Total wire length on LAYER met1 = 168 um.
Total wire length on LAYER met2 = 244 um.
Total wire length on LAYER met3 = 0 um.
Total wire length on LAYER met4 = 0 um.
Total wire length on LAYER met5 = 0 um.
Total number of vias = 100.
Up-via summary (total 100):

----------------------
 FR_MASTERSLICE      0
            li1     56
           met1     44
           met2      0
           met3      0
           met4      0
----------------------
                   100


[INFO DRT-0198] Complete detail routing.
Total wire length = 412 um.
Total wire length on LAYER li1 = 0 um.
Total wire length on LAYER met1 = 168 um.
Total wire length on LAYER met2 = 244 um.
Total wire length on LAYER met3 = 0 um.
Total wire length on LAYER met4 = 0 um.
Total wire length on LAYER met5 = 0 um.
Total number of vias = 100.
Up-via summary (total 100):

----------------------
 FR_MASTERSLICE      0
            li1     56
           met1     44
           met2      0
           met3      0
           met4      0
----------------------
                   100


[INFO DRT-0267] cpu time = 00:00:08, elapsed time = 00:00:00, memory = 497.65 (MB), peak = 509.41 (MB)

[INFO DRT-0180] Post processing.
Setting global connections for newly added cells…
[INFO] Setting global connections...
Updating metrics…
Cell type report:                       Count       Area
  Fill cell                                20      75.07
  Tap cell                                 12      15.01
  Buffer                                    1       3.75
  Timing Repair Buffer                     11      46.29
  Inverter                                  2       7.51
  Multi-Input combinational cell           11      62.56
  Total                                    57     210.20
Writing OpenROAD database to '/home/kien/openlane2/MARCO/decode_day/runs/RUN_2026-01-15_20-14-16/42-openroad-detailedrouting/decode_day.odb'…
Writing netlist to '/home/kien/openlane2/MARCO/decode_day/runs/RUN_2026-01-15_20-14-16/42-openroad-detailedrouting/decode_day.nl.v'…
Writing powered netlist to '/home/kien/openlane2/MARCO/decode_day/runs/RUN_2026-01-15_20-14-16/42-openroad-detailedrouting/decode_day.pnl.v'…
Writing layout to '/home/kien/openlane2/MARCO/decode_day/runs/RUN_2026-01-15_20-14-16/42-openroad-detailedrouting/decode_day.def'…
Writing timing constraints to '/home/kien/openlane2/MARCO/decode_day/runs/RUN_2026-01-15_20-14-16/42-openroad-detailedrouting/decode_day.sdc'…
