Reading OpenROAD database at '/home/kien/openlane2/MARCO/decode_day/runs/RUN_2026-01-15_20-14-16/37-openroad-globalrouting/decode_day.odb'…
Reading library file at '/home/kien/.volare/volare/sky130/versions/0fe599b2afb6708d281543108caf8310912f54af/sky130A/libs.ref/sky130_fd_sc_hd/lib/sky130_fd_sc_hd__tt_025C_1v80.lib'…
Reading design constraints file at '/nix/store/4pyixb03xfwwy77zxxplrggxrmm9f57y-python3-3.11.9-env/lib/python3.11/site-packages/openlane/scripts/base.sdc'…
[WARNING STA-0366] port '__VIRTUAL_CLK__' not found.
[INFO] Using clock __VIRTUAL_CLK__…
[INFO] Setting output delay to: 2
[INFO] Setting input delay to: 2
[WARNING STA-0366] port '__VIRTUAL_CLK__' not found.
[INFO] Setting load to: 0.033442
[INFO] Setting clock uncertainty to: 0.25
[INFO] Setting clock transition to: 0.1499999999999999944488848768742172978818416595458984375
[WARNING STA-0419] transition time can not be specified for virtual clocks.
[INFO] Setting timing derate to: 5%
[WARNING STA-0450] virtual clock __VIRTUAL_CLK__ can not be propagated.
[WARNING STA-0450] virtual clock __VIRTUAL_CLK__ can not be propagated.
[INFO] Setting signal min routing layer to: met1 and clock min routing layer to met1. 
[INFO] Setting signal max routing layer to: met5 and clock max routing layer to met5. 
-congestion_iterations 50 -verbose
[INFO GRT-0020] Min routing layer: met1
[INFO GRT-0021] Max routing layer: met5
[INFO GRT-0022] Global adjustment: 30%
[INFO GRT-0023] Grid origin: (0, 0)
[INFO GRT-0043] No OR_DEFAULT vias defined.
[INFO GRT-0088] Layer li1     Track-Pitch = 0.4600  line-2-Via Pitch: 0.3400
[INFO GRT-0088] Layer met1    Track-Pitch = 0.3400  line-2-Via Pitch: 0.3400
[INFO GRT-0088] Layer met2    Track-Pitch = 0.4600  line-2-Via Pitch: 0.3500
[INFO GRT-0088] Layer met3    Track-Pitch = 0.6800  line-2-Via Pitch: 0.6150
[INFO GRT-0088] Layer met4    Track-Pitch = 0.9200  line-2-Via Pitch: 1.0400
[INFO GRT-0088] Layer met5    Track-Pitch = 3.4000  line-2-Via Pitch: 3.1100
[INFO GRT-0019] Found 0 clock nets.
[WARNING GRT-0036] Pin am_pm is outside die area.
[WARNING GRT-0036] Pin day_num[0] is outside die area.
[WARNING GRT-0036] Pin day_num[1] is outside die area.
[WARNING GRT-0036] Pin day_num[3] is outside die area.
[WARNING GRT-0036] Pin day_num[4] is outside die area.
[WARNING GRT-0036] Pin hour_num[3] is outside die area.
[WARNING GRT-0036] Pin hour_num[1] is outside die area.
[WARNING GRT-0036] Pin day_num[2] is outside die area.
[WARNING GRT-0036] Pin hour_num[2] is outside die area.
[WARNING GRT-0036] Pin hour_num[4] is outside die area.
[WARNING GRT-0036] Pin month[0] is outside die area.
[WARNING GRT-0036] Pin month[1] is outside die area.
[WARNING GRT-0036] Pin month[2] is outside die area.
[WARNING GRT-0036] Pin month[3] is outside die area.
[WARNING GRT-0036] Pin year[0] is outside die area.
[WARNING GRT-0036] Pin year[1] is outside die area.
[WARNING GRT-0036] Pin year[2] is outside die area.
[WARNING GRT-0036] Pin year[3] is outside die area.
[WARNING GRT-0036] Pin year[4] is outside die area.
[WARNING GRT-0036] Pin year[5] is outside die area.
[WARNING GRT-0036] Pin year[6] is outside die area.
[WARNING GRT-0036] Pin hour_num[0] is outside die area.
[INFO GRT-0001] Minimum degree: 2
[INFO GRT-0002] Maximum degree: 4
[INFO GRT-0003] Macros: 0
[INFO GRT-0043] No OR_DEFAULT vias defined.
[INFO GRT-0004] Blockages: 0

[INFO GRT-0053] Routing resources analysis:
          Routing      Original      Derated      Resource
Layer     Direction    Resources     Resources    Reduction (%)
---------------------------------------------------------------
li1        Vertical            0             0          0.00%
met1       Horizontal       1015           498          50.94%
met2       Vertical          756           432          42.86%
met3       Horizontal        504           300          40.48%
met4       Vertical          315           168          46.67%
met5       Horizontal         98            42          57.14%
---------------------------------------------------------------

[INFO GRT-0197] Via related to pin nodes: 93
[INFO GRT-0198] Via related Steiner nodes: 0
[INFO GRT-0199] Via filling finished.
[INFO GRT-0111] Final number of vias: 119
[INFO GRT-0112] Final usage 3D: 418

[INFO GRT-0096] Final congestion report:
Layer         Resource        Demand        Usage (%)    Max H / Max V / Total Overflow
---------------------------------------------------------------------------------------
li1                  0             0            0.00%             0 /  0 /  0
met1               498            26            5.22%             0 /  0 /  0
met2               432            35            8.10%             0 /  0 /  0
met3               300             0            0.00%             0 /  0 /  0
met4               168             0            0.00%             0 /  0 /  0
met5                42             0            0.00%             0 /  0 /  0
---------------------------------------------------------------------------------------
Total             1440            61            4.24%             0 /  0 /  0

[INFO GRT-0018] Total wirelength: 738 um
[INFO GRT-0014] Routed nets: 32
[INFO GRT-0006] Repairing antennas, iteration 1.
[INFO GRT-0043] No OR_DEFAULT vias defined.
[INFO GRT-0012] Found 0 antenna violations.
Placement Analysis
---------------------------------
total displacement          0.0 u
average displacement        0.0 u
max displacement            0.0 u
original HPWL             451.6 u
legalized HPWL            475.7 u
delta HPWL                    5 %

[INFO DPL-0020] Mirrored 15 instances
[INFO DPL-0021] HPWL before             475.7 u
[INFO DPL-0022] HPWL after              451.6 u
[INFO DPL-0023] HPWL delta               -5.1 %
-congestion_iterations 50 -verbose
[INFO GRT-0020] Min routing layer: met1
[INFO GRT-0021] Max routing layer: met5
[INFO GRT-0022] Global adjustment: 30%
[INFO GRT-0023] Grid origin: (0, 0)
[INFO GRT-0043] No OR_DEFAULT vias defined.
[INFO GRT-0088] Layer li1     Track-Pitch = 0.4600  line-2-Via Pitch: 0.3400
[INFO GRT-0088] Layer met1    Track-Pitch = 0.3400  line-2-Via Pitch: 0.3400
[INFO GRT-0088] Layer met2    Track-Pitch = 0.4600  line-2-Via Pitch: 0.3500
[INFO GRT-0088] Layer met3    Track-Pitch = 0.6800  line-2-Via Pitch: 0.6150
[INFO GRT-0088] Layer met4    Track-Pitch = 0.9200  line-2-Via Pitch: 1.0400
[INFO GRT-0088] Layer met5    Track-Pitch = 3.4000  line-2-Via Pitch: 3.1100
[INFO GRT-0019] Found 0 clock nets.
[WARNING GRT-0036] Pin am_pm is outside die area.
[WARNING GRT-0036] Pin day_num[0] is outside die area.
[WARNING GRT-0036] Pin day_num[1] is outside die area.
[WARNING GRT-0036] Pin day_num[3] is outside die area.
[WARNING GRT-0036] Pin day_num[4] is outside die area.
[WARNING GRT-0036] Pin hour_num[3] is outside die area.
[WARNING GRT-0036] Pin hour_num[1] is outside die area.
[WARNING GRT-0036] Pin day_num[2] is outside die area.
[WARNING GRT-0036] Pin hour_num[2] is outside die area.
[WARNING GRT-0036] Pin hour_num[4] is outside die area.
[WARNING GRT-0036] Pin month[0] is outside die area.
[WARNING GRT-0036] Pin month[1] is outside die area.
[WARNING GRT-0036] Pin month[2] is outside die area.
[WARNING GRT-0036] Pin month[3] is outside die area.
[WARNING GRT-0036] Pin year[0] is outside die area.
[WARNING GRT-0036] Pin year[1] is outside die area.
[WARNING GRT-0036] Pin year[2] is outside die area.
[WARNING GRT-0036] Pin year[3] is outside die area.
[WARNING GRT-0036] Pin year[4] is outside die area.
[WARNING GRT-0036] Pin year[5] is outside die area.
[WARNING GRT-0036] Pin year[6] is outside die area.
[WARNING GRT-0036] Pin hour_num[0] is outside die area.
[INFO GRT-0001] Minimum degree: 2
[INFO GRT-0002] Maximum degree: 4
[INFO GRT-0003] Macros: 0
[INFO GRT-0043] No OR_DEFAULT vias defined.
[INFO GRT-0004] Blockages: 0

[INFO GRT-0053] Routing resources analysis:
          Routing      Original      Derated      Resource
Layer     Direction    Resources     Resources    Reduction (%)
---------------------------------------------------------------
li1        Vertical            0             0          0.00%
met1       Horizontal       1015           498          50.94%
met2       Vertical          756           432          42.86%
met3       Horizontal        504           300          40.48%
met4       Vertical          315           168          46.67%
met5       Horizontal         98            42          57.14%
---------------------------------------------------------------

[INFO GRT-0197] Via related to pin nodes: 93
[INFO GRT-0198] Via related Steiner nodes: 0
[INFO GRT-0199] Via filling finished.
[INFO GRT-0111] Final number of vias: 119
[INFO GRT-0112] Final usage 3D: 418

[INFO GRT-0096] Final congestion report:
Layer         Resource        Demand        Usage (%)    Max H / Max V / Total Overflow
---------------------------------------------------------------------------------------
li1                  0             0            0.00%             0 /  0 /  0
met1               498            26            5.22%             0 /  0 /  0
met2               432            35            8.10%             0 /  0 /  0
met3               300             0            0.00%             0 /  0 /  0
met4               168             0            0.00%             0 /  0 /  0
met5                42             0            0.00%             0 /  0 /  0
---------------------------------------------------------------------------------------
Total             1440            61            4.24%             0 /  0 /  0

[INFO GRT-0018] Total wirelength: 738 um
[INFO GRT-0014] Routed nets: 32
[INFO] Setting RC values…
Setting global connections for newly added cells…
[INFO] Setting global connections...
Updating metrics…
Cell type report:                       Count       Area
  Fill cell                                20      75.07
  Tap cell                                 12      15.01
  Buffer                                    1       3.75
  Timing Repair Buffer                     11      46.29
  Inverter                                  2       7.51
  Multi-Input combinational cell           11      62.56
  Total                                    57     210.20
Writing OpenROAD database to '/home/kien/openlane2/MARCO/decode_day/runs/RUN_2026-01-15_20-14-16/40-openroad-repairantennas/1-diodeinsertion/decode_day.odb'…
Writing layout to '/home/kien/openlane2/MARCO/decode_day/runs/RUN_2026-01-15_20-14-16/40-openroad-repairantennas/1-diodeinsertion/decode_day.def'…
