Reading OpenROAD database at '/home/kien/openlane2/MARCO/alarm/runs/RUN_2026-01-16_19-22-04/41-openroad-repairantennas/1-diodeinsertion/alarm.odb'…
Reading library file at '/home/kien/.volare/volare/sky130/versions/0fe599b2afb6708d281543108caf8310912f54af/sky130A/libs.ref/sky130_fd_sc_hd/lib/sky130_fd_sc_hd__tt_025C_1v80.lib'…
Reading design constraints file at '/nix/store/4pyixb03xfwwy77zxxplrggxrmm9f57y-python3-3.11.9-env/lib/python3.11/site-packages/openlane/scripts/base.sdc'…
[INFO] Using clock clk…
[INFO] Setting output delay to: 20000000
[INFO] Setting input delay to: 20000000
[INFO] Setting load to: 0.033442
[INFO] Setting clock uncertainty to: 0.25
[INFO] Setting clock transition to: 0.1499999999999999944488848768742172978818416595458984375
[INFO] Setting timing derate to: 5%
[INFO ORD-0030] Using 16 thread(s).
[INFO DRT-0149] Reading tech and libs.
[WARNING DRT-0349] LEF58_ENCLOSURE with no CUTCLASS is not supported. Skipping for layer mcon
[WARNING DRT-0349] LEF58_ENCLOSURE with no CUTCLASS is not supported. Skipping for layer mcon
[WARNING DRT-0349] LEF58_ENCLOSURE with no CUTCLASS is not supported. Skipping for layer via
[WARNING DRT-0349] LEF58_ENCLOSURE with no CUTCLASS is not supported. Skipping for layer via
[WARNING DRT-0349] LEF58_ENCLOSURE with no CUTCLASS is not supported. Skipping for layer via2
[WARNING DRT-0349] LEF58_ENCLOSURE with no CUTCLASS is not supported. Skipping for layer via2
[WARNING DRT-0349] LEF58_ENCLOSURE with no CUTCLASS is not supported. Skipping for layer via3
[WARNING DRT-0349] LEF58_ENCLOSURE with no CUTCLASS is not supported. Skipping for layer via3
[WARNING DRT-0349] LEF58_ENCLOSURE with no CUTCLASS is not supported. Skipping for layer via4
[WARNING DRT-0349] LEF58_ENCLOSURE with no CUTCLASS is not supported. Skipping for layer via4

Units:                1000
Number of layers:     13
Number of macros:     441
Number of vias:       29
Number of viarulegen: 25

[INFO DRT-0150] Reading design.

Design:                   alarm
Die area:                 ( 0 0 ) ( 50000 50000 )
Number of track patterns: 12
Number of DEF vias:       0
Number of components:     83
Number of terminals:      28
Number of snets:          2
Number of nets:           76

[INFO DRT-0167] List of default vias:
  Layer via
    default via: M1M2_PR
  Layer via2
    default via: M2M3_PR
  Layer via3
    default via: M3M4_PR
  Layer via4
    default via: M4M5_PR
[INFO DRT-0162] Library cell analysis.
[INFO DRT-0163] Instance analysis.
[INFO DRT-0164] Number of unique instances = 30.
[INFO DRT-0168] Init region query.
[INFO DRT-0024]   Complete FR_MASTERSLICE.
[INFO DRT-0024]   Complete licon.
[INFO DRT-0024]   Complete li1.
[INFO DRT-0024]   Complete mcon.
[INFO DRT-0024]   Complete met1.
[INFO DRT-0024]   Complete via.
[INFO DRT-0024]   Complete met2.
[INFO DRT-0024]   Complete via2.
[INFO DRT-0024]   Complete met3.
[INFO DRT-0024]   Complete via3.
[INFO DRT-0024]   Complete met4.
[INFO DRT-0024]   Complete via4.
[INFO DRT-0024]   Complete met5.
[INFO DRT-0033] FR_MASTERSLICE shape region query size = 0.
[INFO DRT-0033] licon shape region query size = 0.
[INFO DRT-0033] li1 shape region query size = 1285.
[INFO DRT-0033] mcon shape region query size = 0.
[INFO DRT-0033] met1 shape region query size = 216.
[INFO DRT-0033] via shape region query size = 55.
[INFO DRT-0033] met2 shape region query size = 33.
[INFO DRT-0033] via2 shape region query size = 44.
[INFO DRT-0033] met3 shape region query size = 59.
[INFO DRT-0033] via3 shape region query size = 44.
[INFO DRT-0033] met4 shape region query size = 41.
[INFO DRT-0033] via4 shape region query size = 18.
[INFO DRT-0033] met5 shape region query size = 30.
[INFO DRT-0165] Start pin access.
[INFO DRT-0078]   Complete 70 pins.
[INFO DRT-0081]   Complete 24 unique inst patterns.
[INFO DRT-0084]   Complete 30 groups.
#scanned instances     = 83
#unique  instances     = 30
#stdCellGenAp          = 613
#stdCellValidPlanarAp  = 8
#stdCellValidViaAp     = 398
#stdCellPinNoAp        = 0
#stdCellPinCnt         = 134
#instTermValidViaApCnt = 0
#macroGenAp            = 0
#macroValidPlanarAp    = 0
#macroValidViaAp       = 0
#macroNoAp             = 0
[INFO DRT-0166] Complete pin access.
[INFO DRT-0267] cpu time = 00:00:05, elapsed time = 00:00:00, memory = 137.94 (MB), peak = 137.94 (MB)

[INFO DRT-0157] Number of guides:     353

[INFO DRT-0169] Post process guides.
[INFO DRT-0176] GCELLGRID X 0 DO 7 STEP 6900 ;
[INFO DRT-0177] GCELLGRID Y 0 DO 7 STEP 6900 ;
[INFO DRT-0028]   Complete FR_MASTERSLICE.
[INFO DRT-0028]   Complete licon.
[INFO DRT-0028]   Complete li1.
[INFO DRT-0028]   Complete mcon.
[INFO DRT-0028]   Complete met1.
[INFO DRT-0028]   Complete via.
[INFO DRT-0028]   Complete met2.
[INFO DRT-0028]   Complete via2.
[INFO DRT-0028]   Complete met3.
[INFO DRT-0028]   Complete via3.
[INFO DRT-0028]   Complete met4.
[INFO DRT-0028]   Complete via4.
[INFO DRT-0028]   Complete met5.
[INFO DRT-0178] Init guide query.
[INFO DRT-0035]   Complete FR_MASTERSLICE (guide).
[INFO DRT-0035]   Complete licon (guide).
[INFO DRT-0035]   Complete li1 (guide).
[INFO DRT-0035]   Complete mcon (guide).
[INFO DRT-0035]   Complete met1 (guide).
[INFO DRT-0035]   Complete via (guide).
[INFO DRT-0035]   Complete met2 (guide).
[INFO DRT-0035]   Complete via2 (guide).
[INFO DRT-0035]   Complete met3 (guide).
[INFO DRT-0035]   Complete via3 (guide).
[INFO DRT-0035]   Complete met4 (guide).
[INFO DRT-0035]   Complete via4 (guide).
[INFO DRT-0035]   Complete met5 (guide).
[INFO DRT-0036] FR_MASTERSLICE guide region query size = 0.
[INFO DRT-0036] licon guide region query size = 0.
[INFO DRT-0036] li1 guide region query size = 107.
[INFO DRT-0036] mcon guide region query size = 0.
[INFO DRT-0036] met1 guide region query size = 76.
[INFO DRT-0036] via guide region query size = 0.
[INFO DRT-0036] met2 guide region query size = 46.
[INFO DRT-0036] via2 guide region query size = 0.
[INFO DRT-0036] met3 guide region query size = 26.
[INFO DRT-0036] via3 guide region query size = 0.
[INFO DRT-0036] met4 guide region query size = 0.
[INFO DRT-0036] via4 guide region query size = 0.
[INFO DRT-0036] met5 guide region query size = 0.
[INFO DRT-0179] Init gr pin query.
[INFO DRT-0245] skipped writing guide updates to database.
[INFO DRT-0185] Post process initialize RPin region query.
[INFO DRT-0181] Start track assignment.
[INFO DRT-0184] Done with 153 vertical wires in 1 frboxes and 102 horizontal wires in 1 frboxes.
[INFO DRT-0186] Done with 3 vertical wires in 1 frboxes and 18 horizontal wires in 1 frboxes.
[INFO DRT-0182] Complete track assignment.
[INFO DRT-0267] cpu time = 00:00:00, elapsed time = 00:00:00, memory = 138.82 (MB), peak = 138.82 (MB)
[INFO DRT-0187] Start routing data preparation.
[INFO DRT-0267] cpu time = 00:00:00, elapsed time = 00:00:00, memory = 138.82 (MB), peak = 138.82 (MB)
[INFO DRT-0194] Start detail routing.
[INFO DRT-0195] Start 0th optimization iteration.
    Completing 10% with 0 violations.
    elapsed time = 00:00:00, memory = 143.34 (MB).
[INFO DRT-0199]   Number of violations = 1.
Viol/Layer        met1
Short                1
[INFO DRT-0267] cpu time = 00:00:04, elapsed time = 00:00:00, memory = 505.59 (MB), peak = 505.59 (MB)
Total wire length = 896 um.
Total wire length on LAYER li1 = 0 um.
Total wire length on LAYER met1 = 546 um.
Total wire length on LAYER met2 = 263 um.
Total wire length on LAYER met3 = 86 um.
Total wire length on LAYER met4 = 0 um.
Total wire length on LAYER met5 = 0 um.
Total number of vias = 259.
Up-via summary (total 259):

----------------------
 FR_MASTERSLICE      0
            li1    132
           met1    101
           met2     26
           met3      0
           met4      0
----------------------
                   259


[INFO DRT-0195] Start 1st optimization iteration.
    Completing 10% with 1 violations.
    elapsed time = 00:00:00, memory = 512.96 (MB).
    Completing 20% with 0 violations.
    elapsed time = 00:00:00, memory = 514.34 (MB).
    Completing 30% with 0 violations.
    elapsed time = 00:00:00, memory = 516.59 (MB).
    Completing 40% with 0 violations.
    elapsed time = 00:00:00, memory = 517.34 (MB).
[INFO DRT-0199]   Number of violations = 0.
[INFO DRT-0267] cpu time = 00:00:04, elapsed time = 00:00:00, memory = 518.46 (MB), peak = 518.46 (MB)
Total wire length = 896 um.
Total wire length on LAYER li1 = 0 um.
Total wire length on LAYER met1 = 546 um.
Total wire length on LAYER met2 = 263 um.
Total wire length on LAYER met3 = 86 um.
Total wire length on LAYER met4 = 0 um.
Total wire length on LAYER met5 = 0 um.
Total number of vias = 259.
Up-via summary (total 259):

----------------------
 FR_MASTERSLICE      0
            li1    132
           met1    101
           met2     26
           met3      0
           met4      0
----------------------
                   259


[INFO DRT-0198] Complete detail routing.
Total wire length = 896 um.
Total wire length on LAYER li1 = 0 um.
Total wire length on LAYER met1 = 546 um.
Total wire length on LAYER met2 = 263 um.
Total wire length on LAYER met3 = 86 um.
Total wire length on LAYER met4 = 0 um.
Total wire length on LAYER met5 = 0 um.
Total number of vias = 259.
Up-via summary (total 259):

----------------------
 FR_MASTERSLICE      0
            li1    132
           met1    101
           met2     26
           met3      0
           met4      0
----------------------
                   259


[INFO DRT-0267] cpu time = 00:00:08, elapsed time = 00:00:00, memory = 518.46 (MB), peak = 518.46 (MB)

[INFO DRT-0180] Post processing.
Setting global connections for newly added cells…
[INFO] Setting global connections...
Updating metrics…
Cell type report:                       Count       Area
  Fill cell                                20      75.07
  Tap cell                                 12      15.01
  Clock buffer                              3      75.07
  Timing Repair Buffer                     27     115.11
  Sequential cell                           2      50.05
  Multi-Input combinational cell           19     145.14
  Total                                    83     475.46
Writing OpenROAD database to '/home/kien/openlane2/MARCO/alarm/runs/RUN_2026-01-16_19-22-04/43-openroad-detailedrouting/alarm.odb'…
Writing netlist to '/home/kien/openlane2/MARCO/alarm/runs/RUN_2026-01-16_19-22-04/43-openroad-detailedrouting/alarm.nl.v'…
Writing powered netlist to '/home/kien/openlane2/MARCO/alarm/runs/RUN_2026-01-16_19-22-04/43-openroad-detailedrouting/alarm.pnl.v'…
Writing layout to '/home/kien/openlane2/MARCO/alarm/runs/RUN_2026-01-16_19-22-04/43-openroad-detailedrouting/alarm.def'…
Writing timing constraints to '/home/kien/openlane2/MARCO/alarm/runs/RUN_2026-01-16_19-22-04/43-openroad-detailedrouting/alarm.sdc'…
